{
  "eventId": "11111111-1111-8111-8111-111111111111",
  "schemaVersion": 1,
  "occurredAt": "2026-08-14T12:00:00.000Z",
  "producer": "minecraft-control-plane",
  "domain": "companion",
  "kind": "action.completed",
  "namespace": "session/22222222-2222-4222-8222-222222222222",
  "householdId": "family-local",
  "sessionId": "22222222-2222-4222-8222-222222222222",
  "correlationId": "33333333-3333-4333-8333-333333333333",
  "visibility": "private",
  "payload": {
    "actionId": "33333333-3333-4333-8333-333333333333",
    "actionKind": "skill.navigateTo",
    "status": "succeeded",
    "resultCode": "arrived"
  }
}
